{
  "schema_version": "1.0.0",
  "reviewed_on": "2026-09-15",
  "coverage": {
    "complete": false,
    "live_verified": false,
    "scope": "Telegram Bot API error responses. Source-derived; hosted deployment behavior is unverified.",
    "examples": "Synthetic examples derived from the cited source."
  },
  "sources": {
    "server-10.3": {
      "kind": "server_source",
      "repository": "https://github.com/tdlib/telegram-bot-api",
      "revision": "e3e9dd8e5b3d7ab8537cd5a10dc31d5ffa8f82d1",
      "version_label": "10.3"
    },
    "response-parameters": {
      "kind": "official_documentation",
      "url": "https://core.telegram.org/bots/api#responseparameters",
      "accessed_on": "2026-09-15"
    }
  },
  "entries": [
    {
      "id": "message.not_modified",
      "category": "message_state",
      "summary": "The requested message content and reply markup are unchanged.",
      "match_any": [
        {
          "error_code": 400,
          "description_exact": "Bad Request: message is not modified: specified new message content and reply markup are exactly the same as a current content and reply markup of the message"
        }
      ],
      "scope": {
        "method_examples": [
          "editMessageText",
          "editMessageCaption",
          "editMessageReplyMarkup"
        ],
        "exhaustive": false
      },
      "possible_causes": [
        "The requested edit repeats the current content and markup."
      ],
      "diagnostic_limits": "The response does not include the current message or establish the history of concurrent edits.",
      "evidence": [
        {
          "source": "server-10.3",
          "path": "telegram-bot-api/Client.cpp",
          "lines": [
            106,
            113
          ],
          "note": "MESSAGE_NOT_MODIFIED is rewritten here; prefix and initial-case handling are at lines 165-205."
        }
      ],
      "example": {
        "method": "editMessageText",
        "response": {
          "ok": false,
          "error_code": 400,
          "description": "Bad Request: message is not modified: specified new message content and reply markup are exactly the same as a current content and reply markup of the message"
        }
      },
      "evidence_level": "source_derived",
      "guidance": {
        "action": "accept_existing_state_if_intended",
        "repeat_request": "unhelpful_without_change",
        "preconditions": [
          "The application considers an already-applied desired state a successful outcome."
        ]
      }
    },
    {
      "id": "message.delete_forbidden",
      "category": "operation_not_allowed",
      "summary": "Telegram rejected deletion of the message.",
      "match_any": [
        {
          "error_code": 400,
          "description_exact": "Bad Request: message can't be deleted"
        }
      ],
      "scope": {
        "method_examples": [
          "deleteMessage",
          "deleteMessages"
        ],
        "exhaustive": false
      },
      "possible_causes": [
        "A permissions, message-type or message-age restriction may prevent deletion."
      ],
      "diagnostic_limits": "The source proves the response mapping, not which deletion restriction caused a particular failure. The causes above are diagnostic hypotheses.",
      "evidence": [
        {
          "source": "server-10.3",
          "path": "telegram-bot-api/Client.cpp",
          "lines": [
            151,
            153
          ],
          "note": "MESSAGE_DELETE_FORBIDDEN is rewritten before the Bad Request prefix is added."
        }
      ],
      "example": {
        "method": "deleteMessage",
        "response": {
          "ok": false,
          "error_code": 400,
          "description": "Bad Request: message can't be deleted"
        }
      },
      "evidence_level": "source_derived",
      "guidance": {
        "action": "check_deletion_eligibility",
        "repeat_request": "after_relevant_change",
        "preconditions": [
          "Check the current deleteMessage rules and bot permissions; a permanent message restriction may have no repair."
        ]
      }
    },
    {
      "id": "query.invalid_or_expired",
      "category": "query_state",
      "summary": "The query ID is invalid or its response window has expired.",
      "match_any": [
        {
          "error_code": 400,
          "description_exact": "Bad Request: query is too old and response timeout expired or query ID is invalid"
        }
      ],
      "scope": {
        "method_examples": [
          "answerCallbackQuery"
        ],
        "exhaustive": false
      },
      "possible_causes": [
        "The query identifier is invalid.",
        "The response arrived after the query's response window."
      ],
      "diagnostic_limits": "The description explicitly combines causes; it does not establish a universal timeout duration.",
      "evidence": [
        {
          "source": "server-10.3",
          "path": "telegram-bot-api/Client.cpp",
          "lines": [
            148,
            150
          ],
          "note": "QUERY_ID_INVALID is deliberately expanded to a description containing alternatives."
        }
      ],
      "example": {
        "method": "answerCallbackQuery",
        "response": {
          "ok": false,
          "error_code": 400,
          "description": "Bad Request: query is too old and response timeout expired or query ID is invalid"
        }
      },
      "evidence_level": "source_derived",
      "guidance": {
        "action": "verify_identifier_and_response_timing",
        "repeat_request": "unhelpful_for_expired_identifier",
        "preconditions": [
          "Use the identifier from the correct incoming query and respond promptly to future queries."
        ]
      }
    },
    {
      "id": "chat.not_found",
      "category": "target_resolution",
      "summary": "The bot could not resolve this chat.",
      "match_any": [
        {
          "error_code": 400,
          "description_exact": "Bad Request: chat not found"
        }
      ],
      "scope": {
        "method_examples": [
          "sendMessage",
          "getChat"
        ],
        "exhaustive": false
      },
      "possible_causes": [
        "An upstream lookup error was replaced with the generic chat lookup message.",
        "A username resolved to a chat type that this lookup does not allow."
      ],
      "diagnostic_limits": "This is not proof that the chat was deleted, the bot was blocked, or the identifier is permanently unusable.",
      "evidence": [
        {
          "source": "server-10.3",
          "path": "telegram-bot-api/Client.cpp",
          "lines": [
            7239,
            7266
          ],
          "note": "A fallback masks upstream 400-class errors, and a separate local branch emits the same description."
        },
        {
          "source": "server-10.3",
          "path": "telegram-bot-api/Client.cpp",
          "lines": [
            85,
            108
          ],
          "note": "Some upstream codes are converted to 400 before the fallback description is applied."
        }
      ],
      "example": {
        "method": "getChat",
        "response": {
          "ok": false,
          "error_code": 400,
          "description": "Bad Request: chat not found"
        }
      },
      "evidence_level": "source_derived",
      "guidance": {
        "action": "inspect_target_and_access",
        "repeat_request": "after_relevant_change",
        "preconditions": [
          "Verify the identifier, target type and bot access before changing stored chat records."
        ]
      }
    },
    {
      "id": "chat.migrated",
      "category": "target_migration",
      "summary": "The group has moved to a supergroup with a new ID.",
      "match_any": [
        {
          "error_code": 400,
          "required_parameters": {
            "migrate_to_chat_id": "nonzero_integer"
          }
        }
      ],
      "scope": {
        "method_examples": [
          "sendMessage"
        ],
        "exhaustive": false
      },
      "possible_causes": [
        "The request addresses a group that was upgraded to a supergroup."
      ],
      "diagnostic_limits": "Use the structured replacement identifier; a description alone does not supply the new target.",
      "evidence": [
        {
          "source": "server-10.3",
          "path": "telegram-bot-api/Client.cpp",
          "lines": [
            8821,
            8827
          ],
          "note": "The replacement chat ID is placed in response parameters."
        },
        {
          "source": "response-parameters",
          "note": "Documents migrate_to_chat_id, including its maximum of 52 significant bits."
        }
      ],
      "example": {
        "method": "sendMessage",
        "response": {
          "ok": false,
          "error_code": 400,
          "description": "Bad Request: group chat was upgraded to a supergroup chat",
          "parameters": {
            "migrate_to_chat_id": -1001234567890
          }
        }
      },
      "evidence_level": "source_derived",
      "guidance": {
        "action": "migrate_chat_reference",
        "repeat_request": "after_target_update",
        "preconditions": [
          "Update the intended chat reference from parameters.migrate_to_chat_id, account for concurrent updates, and bound retries."
        ]
      }
    },
    {
      "id": "bot.blocked_by_user",
      "category": "access",
      "summary": "The user has blocked the bot.",
      "match_any": [
        {
          "error_code": 403,
          "description_exact": "Forbidden: bot was blocked by the user"
        }
      ],
      "scope": {
        "method_examples": [
          "sendMessage"
        ],
        "exhaustive": false
      },
      "possible_causes": [
        "The recipient has blocked the bot."
      ],